,subreddit,title
296,AskReddit,What’s you’re favorite comfort meal after a stressful day?
297,AskReddit,"What are the ""Jock, Nerd, Rebel, Popular Kid"" school archetypes of other time periods?"
298,AskReddit,"If your life went exactly how you planned it going when you were younger, where would you be right now?"
299,AskReddit,What has made you a better person?
300,AskReddit,What are some good tips for being productive in the morning?
301,AskReddit,[Serious] What would you change if you had the power to change a single thing in known history?
302,AskReddit,"Amish posters of Reddit, are you afraid you'll get caught and what would happen if you did?"
303,AskReddit,What is the most unsettling cartoon moment on TV?
304,AskReddit,What's the scariest situation you were in as a kid that involved other kids?
305,AskReddit,"Reddit, what's the weirdest way someone has legitimately confessed their love for you?"
306,AskReddit,What food can you eat a seemingly infinite amount of?
307,AskReddit,What do you want to buy right now that you can't afford?
308,AskReddit,What do you think is the most terrible way to die?
309,AskReddit,What’s an meme/image you saw but were never able to find again no matter how much you looked?
310,AskReddit,What is something that a lot of people do that annoy you?
311,AskReddit,"Tea drinkers of reddit, what is your favourite tea flavour?"
312,AskReddit,"Parents, what did your kids ever teach you about yourselves just by copying you?"
313,AskReddit,"Elders of Reddit, what things seemed important in your younger years that you wish you hadn't wasted so much time worrying about?"
314,AskReddit,What major real world event would spark the most controversy/debate on Reddit if it were to happen?
315,AskReddit,[SERIOUS] How did you come out of the closet?
316,AskReddit,What Trope or Cliche in books movies or shows do you dislike most?
317,AskReddit,What’s the cruelest thing that has ever been said to you?
318,AskReddit,"Mobile users, how are you liking the new Reddit icon?"
319,AskReddit,What two awful things become amazing when combined?
320,AskReddit,What was the worst birthday you ever had?
321,AskReddit,"Other than people who had the right of way, what else are graveyards filled with?"
322,AskReddit,"What is something a co-worker tried to do to fuck you over, but it back fired?"
323,AskReddit,What's the funniest insult you've ever witnessed?
324,AskReddit,"People from English speaking countries that aren't the USA, what are some words and expressions that Americans use that are totally foreign to you, and how do you say them where you're from?"
325,AskReddit,How much of your real world news are you hearing about first from reddit?
326,AskReddit,"What question do you really not want to hear ""...It depends."" as a response to?"
327,AskReddit,What’s the most porn-like thing that has happened to you?
328,AskReddit,What is one song that paints a beautiful story and always hits you in the feels?
329,AskReddit,"If you could go back in time and stop one trend (whether it is now dead or still trending), what would it be?"
330,AskReddit,What's your worst plane flight story?
331,AskReddit,"If Reddit existed in the Ancient Roman era, what would be the top posts of all time?"
332,AskReddit,What's a slur for people who go/went to college?
333,AskReddit,How can you tell when someone is faking being smart when they in fact aren’t?
334,AskReddit,Horror Movie Nuts: What “Halloween” franchise movies do you recommend watching and skipping in order to not be clueless when watching the newest film that will be released next month?
335,AskReddit,What’s a quick joke that works every time?
336,AskReddit,What is not the first thing that you wanna know when you wake up?
337,AskReddit,Do world leaders/scientists have plans for adapting to the human population growth in the coming years? If so what are those plans?
338,AskReddit,"Real Estate agents and workers, what’s the lowest thing another agent has done to you?"
339,AskReddit,What do you have a problem with?
340,AskReddit,"What thing about yourself always makes people go ""wtf""?"
341,AskReddit,What's one of the best experiences you've had in your life so far?
342,AskReddit,"What do you think will happen to the NY Times Op Ed writer who is only known as ""Anonymous"", get's outed?"
343,AskReddit,What's dividing your country into two?
344,AskReddit,What's an album that means a lot to you?
345,AskReddit,"People of Reddit who love their jobs, what do you do?"
346,AskReddit,What sparks your creativity?
347,AskReddit,How do you feel about Tunisia (if at all) ?
348,AskReddit,"What is your best ""broke meal"" that you came up with?"
349,AskReddit,What is the weirdest habit of yours you wouldn't want anyone finding out about?
350,AskReddit,What thing made you dislike your crush?
351,AskReddit,"Redditors who use Bing, and exclusively Bing instead of Google, why?"
352,AskReddit,"What have you done or had happen in life that makes you think, Damn I’ve seen a thing or two?"
353,AskReddit,How has marketing ruined your favorite song?
354,AskReddit,Which subreddits have you recently unsubbed and why?
355,AskReddit,What is the funniest conversation you heard while eavesdropping?
356,AskReddit,How would you describe color to someone blind?
357,AskReddit,Why isn't today friday?
358,AskReddit,What conspiracy theory do you believe the most?
359,AskReddit,"For those of you with traveling jobs, what do you do outside of work when in a different city?"
360,AskReddit,[Serious]What can someone learn in 10 minutes that will be useful for the rest of their life?
361,AskReddit,Why are people so weird about “speaking ill of the dead” when telling stories of shitty things they did while they were alive?
362,AskReddit,[Serious] What are some jobs you can do from home to make a living long term?
363,AskReddit,What's your favorite utensil?
364,AskReddit,"What is something that you have experienced that usually would only happen in the film, tv show or kids show?"
365,AskReddit,[Serious] What is the worst situation you've ever found yourself in?
366,AskReddit,After a long day of work that gets you all sweaty and very hungry do you think it’s better to take a shower first then eat or the other way around?
367,AskReddit,"Teenagers of Reddit, what are some obvious things adults need to know but don’t?"
368,AskReddit,What's a word or phrase you hate when people use?
369,AskReddit,"Couples of reddit who stayed together after their SO cheated on them, what's your story and how did yall make it work? [Serious]"
370,AskReddit,What's the best joke name you've ever seen/heard?
371,AskReddit,What is a little known issue that needs to make mainstream media?
372,AskReddit,"Imagine that your life is a movie, would the movie be interesting? If not, what would you do to make it worth watching? What's the hero's journey, where is the struggle?"
373,AskReddit,What have you bought recently that was inexpensive but changed your life?
374,AskReddit,"If there was a campaign for President of Reddit, what types of things from people's post history would be considered gaffes or scandals?"
375,AskReddit,What part of your body are you insecure about? [Serious]
376,AskReddit,What infuriating task was left out of your job description?
377,AskReddit,What's the hardest thing you've ever had to do even though you didn't want to?
378,AskReddit,"People of reddit who have dated someone famous, has it ever affected the relationship. Why / How?"
379,AskReddit,"People who have open relationships, how do they work long term?"
380,AskReddit,What's your wildest story from your military service?
381,AskReddit,"Besides cheating, what’s another reason that would cause you to end a relationship?"
382,AskReddit,What do you hate about your sex/gender?
383,AskReddit,What's something that you know pretty well that you can offer advice on?
384,AskReddit,What's something you want to do but probably never will?
385,AskReddit,If you scream anything right now every person in the world will hear it and understand it. What do you scream?
386,AskReddit,"What fact about you made someone really surprised, even though it is not that impressive?"
387,AskReddit,What activity gets worse when you are high?
388,AskReddit,What rule did your parents/your school have that ended up completely backfiring on them?
389,AskReddit,"What was the ""gateway song"" that introduced you to your favorite artist?"
390,AskReddit,What's the most interesting compliment you've received in regards to your genitalia?
391,AskReddit,[Serious] how can one learn to stop seeking external validation?
392,AskReddit,What non gamers do you watch on youtube?
393,AskReddit,Redditors with low selfesteem: how did you change it for the better?
394,AskReddit,"It's easy to think of people who make our lives harder...Who in your personal life is a complete joy? In other words, who doesn't annoy you, try to impose their beliefs or opinions, is a generally nice and fun person, is always thoughtful etc.?"
395,AskReddit,"Without naming your occupation, what's the worst thing about it?"
396,AskReddit,What’s the most epic way you’ve seen someone quit their job?
397,AskReddit,"People who live in rural areas, what would you like to ask people from urban areas, and vice versa?"
398,AskReddit,[Serious] Car dealers of reddit: what tricks do you guys use during negotiation that us lowly consumers don’t know about?
399,AskReddit,"Now that you're home and you can finally poop, how was your day?"
400,AskReddit,What’s better if it’s from the store rather than being homemade?
401,AskReddit,"What normal, every day sound really grinds your g(ears)?"
402,AskReddit,You die today. What quote would you want to be put on your tombstone?
403,AskReddit,"How do you show you value someone, without appearing clingy?"
404,AskReddit,Who do you admire in the world outside your family?
405,AskReddit,"Redditors, what's your very minor claim to fame?"
406,AskReddit,What are ways to mildly inconvenience or annoy my shitty roommate without being a complete asshole and/or breaking the law?
407,AskReddit,"(NSFW) People who have appeared in one of those “F*ck a Fan” clips, what was the whole process like?"
408,AskReddit,"Is there anything that you wish you could remind your future self of? If so, what would it be?"
409,AskReddit,[serious] What is the costliest mistake you ever made at work?
410,AskReddit,What cheers you up when you are down?
411,AskReddit,"What's something you really wanted to do or try, but didn't, out of fear of failure?"
412,AskReddit,"What does ""The Star Spangled Banner"" mean to you? How do you feel when it plays, when you sing along?"
413,AskReddit,What's the most impressive thing you've seen someone NOT brag about?
414,AskReddit,"What do most of us agree on, that folks outside of Reddit don't?"
415,AskReddit,What is the most offensive relevant Halloween costume for 2018?
416,AskReddit,"Redditors who have faked their degree or bought it online, how did life turn out for you?"
417,AskReddit,What could you do at your current job that would cause the most damage to the company you work for?
418,AskReddit,"[NSFW] Redditors who waited until marriage to have sex: Was it as good as you dreamt it would be, and how is your relationship with your SO now different?"
419,AskReddit,Which object of yours has travelled the most miles?
420,AskReddit,"Hairstylists, barbers, aestheticians, makeup artists and personal shoppers of Reddit, what mistakes are we making that keep us from being our most attractive self?"
421,AskReddit,What is the most unpleasant sensation you've ever felt?
422,AskReddit,What's the best course of action if someone starts smoking in your subway car and you want them to stop?
423,AskReddit,At what age is it acceptable for humans to be sexually active?
424,AskReddit,Who is the creepiest child you've ever met?
425,AskReddit,What is something at your work that is done that the public has no idea is happening but most certainly should have a right to know?
426,AskReddit,"Men who have gone bald, How have you dealt with male pattern baldness?"
427,AskReddit,What lessons did you learn from the games on your TI-84 Calculator you were required to buy for high school calculus instead of learning calculus and how have they helped you in your life?
428,AskReddit,"[Serious] [NSFW] Redditors with fetishes/kinks, how did you discover them?"
429,AskReddit,What's your honest prediction for the next 10 years?
430,AskReddit,"people who use hallucinogenic, what was your wildest trip?"
431,AskReddit,If you had the option to undo a single event (incident) in your life what would it be and how it would change the present you are in ?
432,AskReddit,What’s some local slang?
433,AskReddit,People who quit smoking cold turkey. Do you feel better now or notice a difference?
434,AskReddit,What are some ways to spend quality time with a spouse that make you feel connected?
435,AskReddit,What's the worst thing you've ever done to someone you were proud of doing?
436,AskReddit,What's something that is arguably simple but you have trouble with?
437,AskReddit,What are your options for playing football after HS and college?
438,AskReddit,"What’s the weirdest swear-word replacement you’ve ever heard (i.e, fudge nuggets instead of the f word)?"
439,AskReddit,What’s the luckiest thing that’s ever happened to you?
440,AskReddit,What's the most inefficient way you saw someone do something?
441,AskReddit,What’s the first thing you’d do after winning 10 million dollars?
442,AskReddit,Which horror movie(s) actually scare you?
443,AskReddit,[Serious] How did you choose you college major?
444,AskReddit,In which career fields could the workers never be replaced by robots?
445,AskReddit,What is your least favourite song?
446,AskReddit,What’s the most ridiculous animal on the planet?
447,AskReddit,What bad advise worked out for you?
448,AskReddit,What is the worst thing you almost said to someone?
449,AskReddit,"What is the biggest house party you've ever been to, and what was the aftermath?"
450,AskReddit,Whats the definition of evil ?
451,AskReddit,Why has Canada's crime rate suddenly increase in the recent months? Why doesn't any sources give a clear explanation? Is there foul play?
452,AskReddit,What angers you that you know shouldn’t?
453,AskReddit,"Users of Reddit, what do you feel is the ""perfect age"" to die?"
454,AskReddit,"IT professionals of Reddit, what is your second source of income?"
455,AskReddit,What's the worst piece of acting for a serious role that you've seen?
456,AskReddit,What to do that can actually change your life in a day?
457,AskReddit,"On Freaky Friday, do you think the people swap bodies or mind, why or why not?"
458,AskReddit,What do you think the worst habit?
459,AskReddit,What's the worst Halloween novelty song you've ever heard?
460,AskReddit,"If you were a pornstar, what category would you participate the most in?"
461,AskReddit,"What would you conclude of a person who claims to play a plethora of instruments, but upon closer inspection can only play a few basic tunes?"
462,AskReddit,"People who've lost substantial weight (100+ pounds), how did you do it? What advice can you give to others who strive to do the same?"
463,AskReddit,If humans could have a software\hardware update what would you ask for in Human V2?
464,AskReddit,What's your favorite thing and why?
465,AskReddit,What is a good way to make someone stop singing who is not good at it?
466,AskReddit,What's the scariest encounter you had with a wild animal?
467,AskReddit,What's the best sexual experience you've ever had?
468,AskReddit,"Fellow Subtitle Translators of Reddit: Despite all the vocabulary you've integrated throughout the years, do you still often use Google Translate/Any methods for knowing what other meanings a word could have/other way it could be interpretated?"
469,AskReddit,[Serious] What's your family's skeleton in the closet?
470,AskReddit,Who is the most physically unattractive celebrity/well-known person that you are attracted to?
471,AskReddit,"Update Human 2.0 is going be released, what human bugs and glitches would you like to be patched in the new update?"
472,AskReddit,What past or current movie series are you most excited to share with your future children?
473,AskReddit,What are some good podcasts with tips to help you improve your life?
474,AskReddit,have you ever wondered about having a mental illness and wether or not you could control it and what would it be?
475,AskReddit,Non-golfers of Reddit- how many pro golfers can you name besides Tiger Woods?
476,AskReddit,What song gave you goosebumps the first time you heard it?
477,AskReddit,What genius solutions to a small problem did you come up with?
478,AskReddit,What are some of your favorite road trip games?
479,AskReddit,What's the best prank you've pulled?
480,AskReddit,[serious] What are some basic life-saving tips that everyone could benefit from knowing?
481,AskReddit,"Redditors of EVERY political persuasion, what changes would you like to see in our government/political system over the next 10 years?"
482,AskReddit,"If you had to pick a single human being that best represents the capabilities of the species, both physically and mentally, who do you pick?"
483,AskReddit,"What was your instance of ""hate at first sight""?"
484,AskReddit,"Furries of Reddit, why?"
485,AskReddit,What was THE moment in your childhood that made you realize that your parents were not perfect?
486,AskReddit,How unattractive is acne to you?
487,AskReddit,What are some good shampoos for thinning hair /reinvigorating hair volume for men that you have used in the past?
488,AskReddit,"Reddit, what cringey moment is keeping you up at night?"
489,AskReddit,What word or phrase immediately makes you think of the 80's and 90's?
490,AskReddit,"Reddit, what's your best House Hunters HGTV job and budget combination?"
491,AskReddit,What is the word for when you have become too used to something? Swear it starts with a d?
492,AskReddit,What is simply not worth the effort?
493,AskReddit,What are your 5 saddest songs?
494,AskReddit,What is something that nobody would want to sponsor?
495,AskReddit,Can other users see who I follow/subscribe to?
496,AskReddit,What do you want to see more and less of in porn?
497,AskReddit,"People who have had sleep paralysis before, what is it like?"
498,AskReddit,Which group of people do Redditors despise the most?
499,AskReddit,"Reddit, what has been the craziest experience you've had while driving?"
500,AskReddit,What are some things that you did or didn’t do that you wish you could change?
