,subreddit,title
0,AskReddit,AskReddit has reached 20 million subscribers!
1,AskReddit,"Men, what is something women have seen in rom coms that you wish they would stop expecting you to do in real life?"
2,AskReddit,"Recycling plant workers of Reddit, what are things that should be done with recyclables to make your job easier?"
3,AskReddit,What are some facts about humans that make us sound bad ass?
4,AskReddit,What's the LEAST impressive thing you've seen someone brag about?
5,AskReddit,What will be the most cliche Halloween costumes of 2018?
6,AskReddit,"80’s and 90’s kids of reddit, What lingo and slang from your childhood and teenage years needs to be brought back?"
7,AskReddit,What the most 'dad' thing you have ever done?
8,AskReddit,[Serious] What about someone you knew was SO creepy that you decided to distance yourself from them?
9,AskReddit,"LGBT is legalised in India. My Indian Fellas, what does this do to you?"
10,AskReddit,"What was something you really wanted to like, but couldn't?"
11,AskReddit,"If your life was a tv show, what would the viewer be screaming at you through the tv for?"
12,AskReddit,You were just killed by a professional in your field of work. How did you die?
13,AskReddit,"You walk up to a tree, underneath the tree is a sword laying at the root with an inscription saying ""whosoever weildeth-"" and then the rest is unreadable, what do you do?"
14,AskReddit,"We always hear about ""dad"" things, what are some ""mom"" things?"
15,AskReddit,What are some of the biggest mistakes people can make in their life?
16,AskReddit,"Older people of Reddit, what's a question you want teenagers to answer?"
17,AskReddit,What freaks you out the more you think about it?
18,AskReddit,How does your SO feel about your ex(s)?
19,AskReddit,What is your favorite quote from a novel? [serious]
20,AskReddit,What's the dumbest arguement you've been apart in?
21,AskReddit,What shady practices are some of the largest companies doing now we should know about?
22,AskReddit,"If you could instantly gain any skill at a pro level, what would it be?"
23,AskReddit,What is equal parts wholesome and creepy?
24,AskReddit,Without saying the name. What is your favourite TV show?
25,AskReddit,What do you not agree with but can still respect?
26,AskReddit,Female ex-inmates: How realistic is the tv series „Orange is the new black“?
27,AskReddit,"Girls, what something men see done in porn that you wish they would stop trying to do in real life?"
28,AskReddit,What is your favorite cartoon of all time and why?
29,AskReddit,What is a silly rule you have for yourself that you actually follow?
30,AskReddit,"If you could quit your job today, how would you do it?"
31,AskReddit,What everyday invention that we use should we really be more impressed about?
32,AskReddit,"People who correct others at every chance you get, why are you like this?"
33,AskReddit,"Dumpster divers of Reddit, what's the coolest thing you've found that someone else threw out?"
34,AskReddit,Where was the worst place you've had to take a dump?
35,AskReddit,What's the most fucked up shit you can do that isn't illegal?
36,AskReddit,"What is something you used to hate, but stopped hating after you got to know it better?"
37,AskReddit,How did you almost die?
38,AskReddit,What's the most ridiculous thing to fill a piñata with?
39,AskReddit,Therapist of Reddit. What are the major redflags of people that might be experiencing depression but tends to shrug them off?
40,AskReddit,What wouldn't work if there were no dumb people?
41,AskReddit,"When online shopping, what’s the most dubious/weird thing you’ve had recommended to you in the “Customers who bought XXXXX also bought YYYYY” section?"
42,AskReddit,What life skills are rarely taught but extremely useful?
43,AskReddit,What was the best feature of the worst person you've dated?
44,AskReddit,"Women, what is something men see done in porn that you wish they WOULD do in real life?"
45,AskReddit,"If you could have an insect that is the size of a large dog, what would you choose?"
46,AskReddit,What are your pros and cons of sleeping nude?
47,AskReddit,What wierd food habbit did you have as a kid (like pealing your fishsticks and eating the components seperatly)?
48,AskReddit,What’s your useless talent?
49,AskReddit,What upset you as a kid that you appreciate as an adult?
50,AskReddit,What is the biggest mystery that you want solved?
51,AskReddit,What's something your sibling told you as a kid just to mess with you?
52,AskReddit,What is your favorite slang for vagina?
53,AskReddit,Why are you single?
54,AskReddit,What is the most underrated state in the United States?
55,AskReddit,"Teachers of Reddit, do you gossip about your students? What did you hear about them?"
56,AskReddit,How often do you upvote something?
57,AskReddit,What's a sentence that has never been uttered in all of human history?
58,AskReddit,What's the most dangerous thing you've done and lived to tell the tale?
59,AskReddit,"Past and Present GameStop employees, what are your best cringe stories?"
60,AskReddit,"If Jesus died in some other way, would churches have a shark or a wood-chipper or whatever at the front instead of a cross?"
61,AskReddit,What did you Google last?
62,AskReddit,"As of right now, 50% of the world’s humans have been turned into zombies. What do you do?"
63,AskReddit,"Redittors who at one point were (or currently are) homeless, how was it and how did you handle it?"
64,AskReddit,"Men of reddit, who is the most inspirational female rolemodel?"
65,AskReddit,What was the most uncomfortable/awkward moment you ever experienced playing Dungeons &amp; Dragons?
66,AskReddit,"If you could replace one item in history with a banana, what would it be and why?"
67,AskReddit,"What’s something your SO does that most people would be annoyed or disgusted by, but you think is very endearing?"
68,AskReddit,"Kids, what secret do your parents THINK they're hiding from you?"
69,AskReddit,What era of looks are you the most attracted to?
70,AskReddit,"Homeowners of Reddit, what is an essential must have for any new homeowner?"
71,AskReddit,what’s your all time favourite album ?
72,AskReddit,What’s your favorite question to ask someone in order to get to know them better?
73,AskReddit,What moment in your life were you expecting to be more Disney-like but got met with pure life and reality?
74,AskReddit,"Without being direct, what is your ethnicity?"
75,AskReddit,"Girls, what something men see done in porn that you WISH they would try to do in real life?"
76,AskReddit,What is the lowest point of your life?
77,AskReddit,What horror movie is legitimately scary?
78,AskReddit,You find a genie who grants you the wish that you can choose a celebrity and the genie will switch his/her body with yours for a week. Whom do you choose?
79,AskReddit,What food do you eat differently than other people?
80,AskReddit,What is your idea of a “perfect” Halloween?
81,AskReddit,"If your life was a FRIENDS episode, what would it be called?"
82,AskReddit,What’s the most expensive thing you’ve broken?
83,AskReddit,Why don't flat earth theorists try practical proofs of flatness like sending up their own personal weather ballon with a camera or personally attempting to sail around the world?
84,AskReddit,What cartoon had the best theme song?
85,AskReddit,What is something you will never understand?
86,AskReddit,What are great ways to save money that not many people know about or utilize?
87,AskReddit,"[Serious] If you ever in a period of your life experienced feelings like emptiness and uselessness and saw no point in living and having goals, how did you deal with these feeling?"
88,AskReddit,Which TV series gets a 10/10 for you?
89,AskReddit,"If every person's answers were ""yes"", what would you ask for?"
90,AskReddit,What fictional character's death was the hardest for you to deal with?
91,AskReddit,What’s worth buying at the dollar store?
92,AskReddit,"If someone had never heard music before in their life, what would be the first song you’d play for them?"
93,AskReddit,"To the older generation, what do you think millennials and Generation Z don't understand about your generation?"
94,AskReddit,What are some things Americans say that are odd or different than other countries?
95,AskReddit,"Poor people of Reddit who became rich, what do you use money for the most?"
96,AskReddit,What's the shadiest thing you've ever seen/heard about that was legal?
97,AskReddit,What is your least rational fear?
98,AskReddit,What's something someone can do to make you like them instantly?
99,AskReddit,What are some facts about humans that make us sound pathetic?
100,AskReddit,"Cops of Reddit, what made you turn a blind eye to crime or let someone off the hook?"
101,AskReddit,What scares you as an adult but didn’t when you were a child?
102,AskReddit,It it just me but when you get to the last sip and it is not a full sip and it is just so unsatisfying?
103,AskReddit,"Older people of Reddit, what's the harshest piece of advice you can give us young folk?"
104,AskReddit,"Retail and service workers of reddit, what can we do to make your day better?"
105,AskReddit,What’s the most oddly specific verb?
106,AskReddit,What song is an undeniable banger?
107,AskReddit,"[Serious] dear people of reddit who have lost a parent, what helped you to deal with the pain?"
108,AskReddit,"We have dad jokes, what are some mom jokes?"
109,AskReddit,What is something you vastly misinterpreted the size of?
110,AskReddit,A genie offers you infinite wishes instead of just 3. What is your first wish?
111,AskReddit,Hairdressers of Reddit. What’s your worse “I fucked up” story?
112,AskReddit,"What are some great, cheap sources of protein?"
113,AskReddit,"What would be the best nickname (e.g. ""deepthroat"") for the current white house leaker?"
114,AskReddit,What's your goto line when you have to quickly exit a conversation?
115,AskReddit,What happens when you get 'scared half to death' twice?
116,AskReddit,What’s your favorite letter of the alphabet and why?
117,AskReddit,"What's your ""you gotta try this"" that probably nobody else knows about?"
118,AskReddit,Whats the best analogy you've ever heard?
119,AskReddit,Why are so many Americans against universal health care?
120,AskReddit,What are the best gifts you have gotten from your SO?
121,AskReddit,Why don’t people like you?
122,AskReddit,"Campers of Reddit, what are the scariest/weirdest/unexplainable things you've experienced while camping?"
123,AskReddit,What is the biggest missed opportunity from your favorite movie(s)?
124,AskReddit,What's a small change you can make to an already delicious food that makes it even better?
125,AskReddit,Do you think religion does more harm than good in the world? Why or why not?
126,AskReddit,Redditors who work at the cash register of a store: what is the most annoying thing you’ve seen a customer say/do?
127,AskReddit,What is a food that you eat everyday that you don't get tired of?
128,AskReddit,Why are you for or against the death penalty?
129,AskReddit,What’s your favorite video game moment?
130,AskReddit,"Hey Reddit, what do you think of homosexuality being legalized in India?"
131,AskReddit,Whats your favourite child hood toy ?
132,AskReddit,"If there were a Mount Rushmore for something other than presidents, what would it be for and who would be on it?"
133,AskReddit,What got you sent to the ER? [Serious]
134,AskReddit,What do you fear since childhood?
135,AskReddit,How can a minor help others with depression?
136,AskReddit,What’s a good horror movie?
137,AskReddit,What's your hangover cure?
138,AskReddit,What states in the US have you visited?
139,AskReddit,People who ragrets getting tattoos...what are they and why did you get them?
140,AskReddit,Whats the best advice you've received for making a better pizza?
141,AskReddit,What clothes do you like the opposite sex to wear?
142,AskReddit,"What is your ""It's a perfect day, everything's great"" song?"
143,AskReddit,"What was something that's common knowledge to most people, but you found out much later in life?"
144,AskReddit,What is something you know you need to work on?
145,AskReddit,What things are normal in video games but would be weird if you did them in public?
146,AskReddit,"In the first year of his presidency, Barack Obama won a Nobel prize for basically being not-George W. Bush. What will the next U.S. President win for being not-Donald Trump?"
147,AskReddit,What do you do to cheer up after a crappy day?
148,AskReddit,"Just pulled my girlfriend's hair out of my nose, What are some other places you've pulled your girlfriend's hair out of ?"
149,AskReddit,"You get 1 hour on the moon, what are you going to do?"
150,AskReddit,How many times out of 10 have you made a decision that you regret because you followed your gut instinct?
151,AskReddit,Which game has the nicest fanbase?
152,AskReddit,"[Serious] Parents who adopted, what was it like to meet your child for the first time?"
153,AskReddit,What is something you wish you had but you know you shouldn’t have?
154,AskReddit,What can a person learn/know right now in 10 minutes that will be useful for the rest of their life?
155,AskReddit,"Reddit, if a man gets a woman unintendedly pregnant, what is your opinion on them questioning if an abortion is the appropriate course of action?"
156,AskReddit,"Parents, have you ever been scared of your child? Why &amp; What did they do to scare or threaten you? [serious]"
157,AskReddit,"What is something that is probably not true, but that you choose to believe in anyways?"
158,AskReddit,What's the one thing you should never brag about?
159,AskReddit,What's a food combination that sounds nasty but it's actually good?
160,AskReddit,"Have you ever been browsing Reddit, and come across a post that you realised was about you? What was the context?"
161,AskReddit,"Einstein said “If you can't explain it to a six year old, you don't understand it yourself.” How would you explain your job?"
162,AskReddit,"If you didn’t have to worry about money, what would you do all day?"
163,AskReddit,"College students of reddit, what class did you find most interesting that wasn’t related to your major?"
164,AskReddit,Whats worse than sitting on a still warm public toilet seat?
165,AskReddit,"Reddit nurses/doctors! what’s an interesting, weird, or disgusting medical story you can share?"
166,AskReddit,What's the weirdest thing you've seen on Google Street View?
167,AskReddit,"What did your parents irrationally prevent you from doing, and why?"
168,AskReddit,"If Mike Pence was the one that wrote the Op/Ed, what could Donald Trump do about it. A Vice President cant be fired but what could happen?"
169,AskReddit,What is something you love about your partner but don't say enough?
170,AskReddit,"Redditors that work with videogames (art, development, code, design), how did you get there?"
171,AskReddit,What stopped being cool once your parents started to use it?
172,AskReddit,What's your favorite tongue twister?
173,AskReddit,"People who order a salad with dressing on the side, why?"
174,AskReddit,"Older men of reddit, what's one piece of advice you can give a guy who is 22 and going out to try to get laid tonight?"
175,AskReddit,What do you consider to be your best quality? [serious]
176,AskReddit,"You discover an alien in your backyard, what course of action would best express your personality?"
177,AskReddit,At what age did you consider yourself no longer “young”?
178,AskReddit,"People who have came into contact with serial killers or were extremely close to being kidnapped, what happened and when did you come to that realization?"
179,AskReddit,What was something you really wanted to buy but couldn’t?
180,AskReddit,People who stayed with their ‘High School Sweetheart’ — How did that go for you?
181,AskReddit,If you could talk to your Soulmate for 30 seconds what would you tell them?
182,AskReddit,What are your top five movies?
183,AskReddit,What is the stupidest thing you've seen someone do at the gym?
184,AskReddit,What’s the most “I don’t give a fuck about this job” thing you’ve ever seen someone do at work?
185,AskReddit,What is the stupidest thing someone has bragged to you about?
186,AskReddit,How do you dress your lower half? Socks pants or pants socks? Sock sock shoe shoe or sock shoe X2?
187,AskReddit,"What ""poor man's food"" in your country that is considered luxury in western countries?"
188,AskReddit,"College reddit, what is your worst cock block experience?"
189,AskReddit,"Introverts, how did you meet your SO?"
190,AskReddit,"Passport control officers of reddit, why are you grumpy?"
191,AskReddit,"911 Dispatchers of Reddit, what is the most memorable call you have ever taken? What call will stick with you for the rest of your life?"
192,AskReddit,What are some of the most original television shows aside from Firefly that didn't get the recognition or the length they deserved?
193,AskReddit,Redditors who like Alex Jones and watch his show: why do you do that?
194,AskReddit,What are some facts about humans that make us seem like wimps?
195,AskReddit,How is life like without having kids ?
196,AskReddit,"I’m going on a picnic and I’m bring jelly, apples, and mustard. What are you bringing?"
197,AskReddit,"What’s something you do to damage your body everyday, besides smoking cigarettes and drinking alcohol?"
198,AskReddit,Why do you smoke?
199,AskReddit,What was the funniest TED Talk you’ve ever seen?
200,AskReddit,How come you can’t decline a call while on the lock screen on apple?
201,AskReddit,What's the MOST impressive thing you've seen someone NOT brag about?
202,AskReddit,What's a memory from your childhood that still haunts you?
203,AskReddit,"Have you ever thought of killing your self, and why?"
204,AskReddit,"Students of Reddit, what's one thing you wish professors understood?"
205,AskReddit,What is your party trick and how did you discover it?
206,AskReddit,What place on earth is only famous because of something bad that happened there?
207,AskReddit,Gamers of reddit. What was the first game you ever played?
208,AskReddit,"Elopers of reddit, were you happy with your decision to elope? Why or why not?"
209,AskReddit,What food have you never eaten but would really like to try?
210,AskReddit,"Magicians of Reddit, what secrets can you share with us?"
211,AskReddit,Which state (except the one you reside in) is the best state? Why?
212,AskReddit,"Dental floss packaging says to use 18"" at a time when you really only need 9"" or so. What other product's directions misrepresent how to use them in an effort to get you to buy more often?"
213,AskReddit,What are some lesser known but worthwhile travel spots that don't get too crowded?
214,AskReddit,What are some video games that have enemies/ NPCs that say hilarious and or interesting stuff?
215,AskReddit,"Gay people who’ve had sex with the opposite sex, what was it like?"
216,AskReddit,What is the best decision you've ever made?
217,AskReddit,"What do you technically do ""wrong"" but don't want to change?"
218,AskReddit,"If you had the money, time, and the motivation, what would your small business/startup be?"
219,AskReddit,What video game series has the worst fan base?
220,AskReddit,What’s your advice to the teens of Reddit?
221,AskReddit,"Men, do you follow the “Urinal Buffer Rule?” If not, why not?"
222,AskReddit,Which post did you wish you could give someone gold for?
223,AskReddit,"If your SO could read your thoughts during sexy time, would they like what they “heard”?"
224,AskReddit,What would be the worst thing to use as a chair?
225,AskReddit,What teenage slangs don’t make sense to you?
226,AskReddit,What's the most impressive thing you have to brag about?
227,AskReddit,"If it’s only the “true” redditors who sort through new content for us lurkers, why do we see sooooo many repost hitting the front page all the time?"
228,AskReddit,"Reddit, how quickly do you type?"
229,AskReddit,What is completely deserving of hate and why?
230,AskReddit,"Parents, what sectets do your kids THINK they're hiding from you?"
231,AskReddit,What is the purpose of life?
232,AskReddit,"Hypothetically, if every human orgasm were to be matched with a random human’s death, what would the next week look like?"
233,AskReddit,"How did you react when you realized Gustavo Fring was an Extra in the Movie Trading Places, in the scene where Eddie Murphy demonstrates the ""Quart of Blood"" Technique, in Cell Number Four, on the Ninth Floor?"
234,AskReddit,What's one personal rule you always break?
235,AskReddit,What's your unusual snack of choice?
236,AskReddit,How many reddit followers do you have?
237,AskReddit,What’s your favorite song lyric?
238,AskReddit,People who have posted NSFW content has anyone ever caught you or found out?
239,AskReddit,What are some of the more outlandish lies your parents told you as a kid to stop you from doing something?
240,AskReddit,"In Germany, a person named ""Kevin"" is automatically assumed to be dumb. What are the""dumb names"" in your country?"
241,AskReddit,What is your go to emotional song?
242,AskReddit,"Redditors with an annual income of over $250k (including bonuses), how has wealth affected your life?"
243,AskReddit,Who or what is much older than people usually think?
244,AskReddit,"What's a TV show or movie than you only vaguely remember, and sound crazy when you try to explain it to someone else?"
245,AskReddit,How do you cope with being mediocre?
246,AskReddit,What are some of your oldest dreams you can remember?
247,AskReddit,Who is your favorite redditor?
248,AskReddit,"DMV workers of Reddit, what could be done, by us or you, to reduce wait times?"
249,AskReddit,What does it mean to have a social life in today’s world?
250,AskReddit,"Reddit, in your opinion, what is the funniest word in the human language?"
251,AskReddit,What's the biggest decision you've made today?
252,AskReddit,"People who have worked on a movie set, what are your horror stories?"
253,AskReddit,What do you need right now?
254,AskReddit,What skill or talent that you have would you trade for a different skill?
255,AskReddit,"1972, Watergate, Woodward. We had Deep Throat. What should the nickname be for the anonymous editorial about the Trump White House be?"
256,AskReddit,"People who said ""no"" to a marriage proposal, what was your reason?"
257,AskReddit,What's your opinion on tattoos?
258,AskReddit,"If 'It' came back in 2018, instead of a clown, what would his form be?"
259,AskReddit,What smell do you miss?
260,AskReddit,What are some of the most pointless things to spend money on?
261,AskReddit,"How much did it cost you to go to Europe from the US, how long did you stay, and what did you do?"
262,AskReddit,What is something we don't normally eat but would probably taste delicious?
263,AskReddit,How do you eat unhealthy foods without feeling guilty/unfit?
264,AskReddit,What was the BEST moments you've experienced while playing Dungeons &amp; Dragons?
265,AskReddit,"Men, what is something women see in porn that you wish they would stop perpetuating in real life?"
266,AskReddit,"Figure skaters, what advice do you have for a 12 year old, not the healtiest kid, if she wants to start figure skating?"
267,AskReddit,[Serious] How do you deal with your anxiety?
268,AskReddit,Hi Reddit! What obscure song or band do you love?
269,AskReddit,What’s your opinion on grilled cheese?
270,AskReddit,Why do our brains choose to remember some events from long ago so vividly while most others are forgotten?
271,AskReddit,What TV show character would it be the most fun to change places with for a week?
272,AskReddit,How would you describe your handwriting?
273,AskReddit,What Subreddit led to you meeting a fellow Redditor in REAL life and how did that go?
274,AskReddit,"Older people of Reddit, what ages do you remember to be the ""best time of your life""?"
275,AskReddit,"I’m moving next week, what are your best moving tips?"
276,AskReddit,"Besides mayor, what city-level position is the most powerful?"
277,AskReddit,"Which decade has the better music, 2000's or 2010's?"
278,AskReddit,What were you thinking about before you read this?
279,AskReddit,"historians, and current events experts of reddit, what events of the past few years will be taught in history classes 40 years down the road?"
280,AskReddit,"What, if anything is better than drunk posting?"
281,AskReddit,"Which “knock-off” product(s) is just as good, if not better than the “name-brand” product(s)?"
282,AskReddit,What did you do before it was cool?
283,AskReddit,"People who married against their parent’s wishes, how did your marriage turn out?"
284,AskReddit,"[Serious] People who were / felt ""trapped"" in a relationship, how did it happen and how did you get out ?"
285,AskReddit,Right now you have 3 things on top of your bedside table which outlines your character. What are they?
286,AskReddit,Have you ever found your old writing from grade school? If so what was the funniest thing you wrote?
287,AskReddit,What's been the best troll you've ever seen at school?
288,AskReddit,What is your favorite podcast?
289,AskReddit,[Serious] What's the scariest thing you had to experience because of who you are?
290,AskReddit,Tradespeople of Reddit- What product or service would you say is the best in your profession?
291,AskReddit,"Exterminators of Reddit, what is the most awful infestation you have ever seen in a house or building?"
292,AskReddit,What would the consequences be (both positive and negative) if Northern Ireland joined the Republic?
293,AskReddit,"If you could remodel the human physiology, what features would you add and/or remove?"
294,AskReddit,What's the most annoying trendy thing/saying people use to define their personality?
295,AskReddit,What's a song you can't bring yourself to listen to anymore?
