,subreddit,title
345,books,"I just read ""All the Light We Cannot See"" by Anthony Doerr. I am amazed!"
346,books,"Just read Andrew Sean Greer's ""Less"""
347,books,Genres? Does Not Compute!
348,books,"I’m not crying, you’re crying..."
349,books,The Master and Margarita - on Chpater 21 and utterly bored - should I continue to read?
350,books,What would your fictional book be?
351,books,Just finished Don Quixote part 1
352,books,just finished: The Night Market by Jonathan Moore
353,books,"""A Tale of Two Cities"" - Charles Dickens"
354,books,"I'm looking for a book reading app, but not an app for reading books"
355,books,How to read self help books?
356,books,"RIP Kate Daniels series, what are some of your favorite parts? Also what do you hope will happen?"
357,books,Should I just start a different book?
358,books,The Master Key System.
359,books,John Dies @ The End by David Wong
360,books,Knut Hamsun's Hunger made me feel like I was going to have a panic attack. Any books ever impact your mental state like that?
361,books,Lou Berney—Amazing Crime Fiction
362,books,Anyone else a fan of The Story of My Teeth by Valeria Luiselli?
363,books,Robin Hobb's Elderling Universe and feelings of deflation
364,books,"Tired of obnoxious, uninteresting book advertisements."
365,books,Which one of you bitches is my mother?
366,books,"Weekly Calendar - August 27, 2018"
367,books,I finished Stephen King’s 11/22/63 last night. I’m still shaken up.
368,books,Martian Time Slip by Philip K. Dick
369,books,Skim reading is the new normal. The effect on society is profound
370,books,Just finished Louis de Bernieres’ “Corelli’s Mandolin”. I’m absolutely blown away.
371,books,Which director would you like to adapt which book?
372,books,The literature curriculum in American high schools seems to be a contentious issue. Do you agree with his writer's take on what should stay and what should go? What would you add?
373,books,What's your comfort book?
374,books,What book would you love to see get a high budget movie in 2018/2019?
375,books,The Perks of Being a Wallflower is one of the greatest books I’ve read and ever will read
376,books,What book have you read and for the life of you not understand why others dont love it?
377,books,*Spoilers* What book death hurt the most?
378,books,Websites like FanFiction.com but with original stories?
379,books,"I love listening to conversations with authors, yet their books do nothing for me"
380,books,Do you actively summarize paragraphs or chapters when you read?
381,books,The Stand - Stephen King. Thoughts?
382,books,"Marcel Proust’s Dream of Art: Proust’s mid-career struggles with writing led him to art criticism, which provides clues to the qualities prized by readers of In Search of Lost Time."
383,books,Just Finished Lord of the Flies by William Golding and would like to discuss - Possible Spoilers
384,books,Educated by Tara Westover
385,books,Just finished reading 'American Psycho' - un-believe-able!! Best book I've read in years ~
386,books,Wuthering Heights - Tough Read
387,books,What do you guys think of Haunted by Chuck Palahniuk?
388,books,"I read The Dark Tower #1, thought it was bad, so now I have no desire to follow it up"
389,books,What are your favourite middle grade books? Do you still read middle grade stories as an adult?
390,books,Is Literature Dead?
391,books,"The greatest gift I've ever received. A Copy of, ""A Study in Scarlet"" from 1914."
392,books,Just finished reading The Exorcist and I'm slightly conflicted.
393,books,Just finished 'Bonfire of the Vanities' - Wow!
394,books,A Man Called Ove (possibly spoilers?)
395,books,How does Asimov exposit so unobtrusively in the Foundation trilogy?
396,books,I have a questions about The Book of Lost Things by John Connolly.
397,books,Weekly FAQ Thread August 26 2018: What book changed your life?
398,books,The Ending of Fahrenheit 451
399,books,Why do so few middle grade books feature LGBT characters?
400,books,From the Guardian - The implications of skim reading as the new normal
401,books,About Gray - E.L.James
402,books,"Question about ""Killing Me Softly"" by Nicci French"
403,books,Mini-rant on troped up villains.
404,books,"Escapism via Travelogues: ""The Kingdom by the Sea"" and ""Deep South"" by Paul Theroux"
405,books,What does this line from Blood Meridian mean?
406,books,Is the Appendix in a book considered part of the book?
407,books,Concord Massachusetts' Main Library maintains a collections of over 6000 works dating back to 1646 of authors that have lived in Concord
408,books,Just finished the Mistrborn Trilogy - Wow.
409,books,Am I missing something about The Gunslinger?
410,books,Good books primarily for reading experience
411,books,"Tor Publishing Issues a 4-Month E-Book Embargo on Libraries, Cites Retail Sale Concerns"
412,books,"Kurt Vonnegut: ""You will see this story over and over again. People love it and it is not copyrighted. The story is 'Man in Hole,' but the story needn't be about a man or a hole. It's: somebody gets into trouble, gets out of it again."""
413,books,Is Stephen King worth it at all?
414,books,Why do people believe in trainable speed reading?
415,books,H is For Hawk by Helen MacDonald (Contains Quotes From Book)
416,books,"The real Emily Bronte was red in tooth and claw, forget the on-screen romance"
417,books,Just finished Blood Meridian...
418,books,"I decided to make August a month of thrillers. Here's what I thought (NO SPOILERS) of Ultraluminous, Before I Go to Sleep, Bird Box, and The Innocent"
419,books,Have you ever half listened to/half read a book?
420,books,"Koestler’s Darkness at Noon often reads like a literal description of certain political climates. In particular is this one quote, which is uncanny:"
421,books,"""It really is something"" is how ended the short story Cathedral in Raymond Carver's masterful anthology of short stories _Cathedral_"
422,books,[Spoilers] Almost done with Throne of Glass! A question/plot hole:
423,books,What am I missing of The Black Company by Glenn Cook?
424,books,Kings collection in macrouniverse chronilogical order
425,books,Finished Dune (Book 1) Questions [Spoilers]
426,books,What one author is most representative of your culture's literary style?
427,books,My absolute obsession with The Kingkiller Chronicles
428,books,What's your opinion on the PoV characters style of narration like in The Expanse or ASOIAF ?
429,books,Finished reading the ABC Murder by Agatha Christie
