,subreddit,title
382,gaming,"This is someone's award that ended up at Goodwill, unfortunately. I bought it because it's cool! It has Reggie and Kimishima's signatures, among others. From what I could find, this was from around 2002-03."
383,gaming,"A new online Lord of the Rings game is coming, set before Frodo's quest"
384,gaming,"Throwback to FIFA 07, One of the best songs chose by FIFA"
385,gaming,Awesome Battlefield V in-game footage!
386,gaming,How many hours a day do you spend gaming and what real-life obligations do you maintain?
387,gaming,You know what current gaming trend I'm getting tired of seeing?
388,gaming,Old Game that I Can't Remember It's Name
389,gaming,Rebel Galaxy Outlaw: 1 Hour of Gameplay Footage (feat Travis Baldree from Double Damage Games)
390,gaming,CCP bought by Pearl Abyss for 425 million
391,gaming,Are there any good current gen or upcoming medieval fantasy RPGs?
392,gaming,Waiting for the next RDR trailer
393,gaming,I see your Pokemon Go Missingno and I raise you mine.
394,gaming,THQ squires Kingdoms of Amalur IP
395,gaming,[Help] Picking a Gaming PC
396,gaming,Rate my setup (Raspberry Pi3 w/ 3.5inch LCD Touchscreen Display)
397,gaming,"Condensed all my consoles, DVDs, and cable box to one device. Love my gaming setup!"
398,gaming,Is playing Far Cry 4 like this still fun?
399,gaming,Gaming/esport related coffee cup (travel version)
400,gaming,Got a new piece today for my birthday
401,gaming,"Update on the Matchmaking Error Codes: [6-0x00001000], [2-0x0000D0012]"
402,gaming,Curt Schilling's Disastrous Role-Playing Games Find a New Home
403,gaming,Free gaming at the ESports Arena Las Vegas - Military
404,gaming,Destiny 2 Forsaken
405,gaming,Thought you guys might like my Pyramid Head Tattoo ^_^
406,gaming,2K asks fans to tell Belgium they want loot boxes
407,gaming,Today's going to be a good day 😎
408,gaming,Steam Speacials - 30% Price Drop to $17.99 - Sci Fi Tower Defense - Have you bought it?
409,gaming,Looking for some great games for PC
410,gaming,Sony Playstation’s HQ Building
411,gaming,Starflight 3 is coming! Take my money!
412,gaming,What are your favorite slow-paced games for PC?
413,gaming,Coldest adventure ever
414,gaming,Dark Souls fire keeper question
415,gaming,Is the Witcher 2 any good
416,gaming,Nike Effect 3
417,gaming,My opinions about battlefield 5 on ps4
418,gaming,Fighting games recommendations
419,gaming,"The Division is free to try this weekend, 70 percent off for a limited time"
420,gaming,Pablo Sanchez for Smash Ultimate
421,gaming,Why Government Gamification Still Matters: Gamification is becoming increasingly important in civilian and defense matters.
422,gaming,Are 50 fps +- good or not? Why?
423,gaming,Took this earlier today. I can't wait any longer.
424,gaming,Spiderman PS4's Homecoming Suit
425,gaming,Steam Help- All games?
426,gaming,RPG Logic
427,gaming,Most intense jump-scare moment in recorded history
428,gaming,Spider-Man PS4 Playlist
429,gaming,Just over a month ago I found the leak for Lego Harry Potter on Xbox and Switch and now it's offical.
430,gaming,"60 hours later, my first ever 100% completion"
431,gaming,New free DLC for Egypt: Old Kingdom allows you to fight alien invasion in Ancient Egypt.
432,gaming,Marvel's Spider-Man - Special or Digital Deluxe Edition?
433,gaming,Since nobody at this sub would answer me maybe one of y’all here can offer some assistance
434,gaming,Found some old NES games cleaning out garage!
435,gaming,The Overwatch League finals got really intense!
436,gaming,Boiii!!
437,gaming,"Does anyone else experience intense nausea playing Skyrim or Bioshock after a few hours or so? If so, how do you get rid of it?"
438,gaming,Can you help me with starting a stream channel? [Serious]
439,gaming,Battle Royale except it's you vs 999 other players
440,gaming,How do Game Developers and Publishers work?
441,gaming,Retro Dice: D-PAD D6 - Control your destiny!
442,gaming,My god they've finally done it
443,gaming,Question about Steam Machines
444,gaming,"Tarzan Untamed Gamecube Nostalgia- Being unable to press the button fast enough to win as a kid, so gave up on the game (Nostalgia)"
445,gaming,"I've been making Pokémon in LEGO Digital Designer, here is the 5th one + a Time Gear from Pokémon Mystery Dungeon Explorers"
446,gaming,"Next time you play Minesweeper, play Saw OST (Hello Zepp) in the background"
447,gaming,This was in the store where they sell bathtubs - great advertisement
448,gaming,Fallout3 has stopped working
449,gaming,Anyone else love this song?
450,gaming,Thq Nordic questions..
451,gaming,"This is my favorite welding cap, I thought you all might like it too!"
452,gaming,Favorite game of all time?
453,gaming,GameStop open early for Spider-man release?
454,gaming,Two Point Hospital Removes Denuvo Anti Tamper In Favour of SteamDRM
455,gaming,Should I get the Witcher III?
456,gaming,The Truth About Battlefield V
457,gaming,"GTA 5 is an amazing game! Example A: this dude at the back of a warehouse Rockstar could have made a basic character not doing alot, 2 or 3 moves. But NO! whoever decided to put this much effort into a character that is at the back of a warehouse most wouldn't even see..... I salute you!"
458,gaming,EVE Online studio CCP Games has been acquired by Pearl Abyss
459,gaming,This series needs a remake.
460,gaming,SPIDERZON
461,gaming,Insomniac’s Spider-Man - does anyone know if Sam Raimi suits are coming to the game in the future?
462,gaming,THQ Nordic hopefully bought this as well - Kingdoms of Amalur MMO
463,gaming,"[DBZF]Jesus Christ Goku, he's your friend!"
464,gaming,Upcoming games
465,gaming,Wait...what?
466,gaming,Remake please. I remember this game fondly and loved the crap out of it.
467,gaming,"Behold, The""Greaseproof"" Xbox One Controller"
468,gaming,Fortnite Cube!
469,gaming,What’s the most money you spent on a game? And what’s the amount?
470,gaming,Pc upgrade that I’m unsure of.
471,gaming,This borderlands psycho stencil i made
472,gaming,Tom clancy's rainbow 6 siege's grim sky is broke af
473,gaming,About Witcher.
474,gaming,"While browsing the contents of a long forgotten flash drive, I came across a pic of a Halloween costume that I was apparently very proud of..."
475,gaming,"Find a Flaw, Pro Tip: You cannot"
476,gaming,My coworkers locker at work....
477,gaming,Anyone can recommend video series for Unreal Engine 4?
478,gaming,Garden Paws - Kickstarter Game Getting Not Nearly Enough Attention
479,gaming,"Need help with technical Xbox controllers. Circuits, PCB, soldering and diagrams"
480,gaming,Please Recommend me this type of Video Game
481,gaming,Avengers United reel
482,gaming,Will we ever get a DC game about The Flash or Superman?
483,gaming,"Never played any JRPGs in my life, Can i get some recommendations?"
484,gaming,Spider-Man PS4...I don’t have it yet...LITERALLY unplayable.
485,gaming,"In whatever console war, which console do you think had your most undying support?"
486,gaming,Forgot how beautiful this game was.
487,gaming,...
488,gaming,When you bring a girl home and about to smash
489,gaming,How tragic.
490,gaming,Difference between Spider-Man normal and deluxe edition?
491,gaming,"I just woke up, what happened in Japan that it stopped Nintendo direct?"
492,gaming,What are some good games to play while listening to podcasts?
493,gaming,EA can sell the same game every year and people still buy it. EA is like Apple of gaming world.
494,gaming,"Before the internet... when you were stuck in a game, at least you had options for help. For a mere $3 a minute."
495,gaming,"I've been making Pokémon out of LEGO in LEGO Digital Designer/Stud.io, Here is the 7th Riolu, and it is buildable IRL. Check the comment below to view, download, or buy the model."
496,gaming,My First Big Mobile Project
497,gaming,"Black Desert Online Creators Pearl Abyss to Acquire CCP Games, Makers of EVE Online"
498,gaming,Unfortunate placement there Steam
499,gaming,"what do you think about TV series The Withcer , when Henry cavill will be Geralt .."
