,subreddit,title
0,gifs,/r/Gifs rules: Please read before submitting or commenting
1,gifs,"The Broadway cast of ""Frozen"" has had enough of your shit, sir."
2,gifs,"Heartwarming surprise, two waitresses say 'Happy birthday' to a hearing-impaired four-year-old in sign language."
3,gifs,Wedding photography
4,gifs,Dragon Scale Armor
5,gifs,“Fuck this shit”
6,gifs,Finn watching his favorite movie (watch for the spot where Finn draws his head back a bit in surprise right as Ferdinand does in the film)
7,gifs,they sssssssee me rolling
8,gifs,8-bit side scrolled cosplay by Dan Cattell Art
9,gifs,Jiggly Jiggly dance
10,gifs,Vertical Somersault on the wall
11,gifs,Skating in heels.
12,gifs,Brazilian candidate for presidence getting stabbed today[NSFW)]
13,gifs,Nailed it !
14,gifs,Synchronized Backflip
15,gifs,"That's what they call ""a dodge"""
16,gifs,"This is I-5 right now near Redding, CA"
17,gifs,Telling a story with 3 paper cups
18,gifs,Majestic Lion
19,gifs,It’s a beautiful day
20,gifs,Smile
21,gifs,play dead
22,gifs,Wrestling isn't fake!
23,gifs,Corgi playing catch
24,gifs,Never Mind !!! I Help U
25,gifs,World's largest man-made waterfall flows from Chinese skyscraper
26,gifs,Free hugs
27,gifs,But how?
28,gifs,MUST........KEEP........OFF.........GRASS
29,gifs,what a catch!
30,gifs,Guess it wasn’t his day
31,gifs,Sup from the garden eels...
32,gifs,Feeding time
33,gifs,Window waterfall on a rainy day
34,gifs,Don't move!
35,gifs,Ultimate Parkour jumper.
36,gifs,A walk in the flowers land
37,gifs,Majestic lion
38,gifs,My work here is done.
39,gifs,MAGNETIC HENG BALANCE LAMP
40,gifs,Mom is drunk again
41,gifs,hugs me pls
42,gifs,Am I dreaming
43,gifs,Oh the betrayel!!
44,gifs,Military leader mistakes pointing gesture for handshake
45,gifs,R.I.P. Burt Reynolds.
46,gifs,Bouncy skippy happy truck!
47,gifs,Ultra jump
48,gifs,Just a watermelon
49,gifs,"Minutes ago on the Vuelta Espana cycling race. Wrong time, wrong place, dude. I hope your glasses are OK, though."
50,gifs,What special skills do you have
51,gifs,Why me? Because you're perfect.
52,gifs,What Karate Kicks!
53,gifs,Icelandic Rush Hour [OC]
54,gifs,A four month old elephant playing with a stick.
55,gifs,Walking through Wisteria
56,gifs,Explosive Night Vision Fart
57,gifs,Fernandina Beach Florida
58,gifs,Backflipping a dirtbike over an aerobatic plane
59,gifs,I would pay good money to know exactly what direction Marin Scorsese gave to this bandleader guy during the filming of this scene from The Aviator
60,gifs,White Power!!!
61,gifs,Another Celebrity Death?
62,gifs,Drone footage of the tree nursery I work at. Grow 80 million pine trees per year.
63,gifs,Officer pumping up kids for their first day back at school
64,gifs,Bubbles wagging his tail and playing with toy
65,gifs,"I made this gif from a reddit post, but I would love to find that original post"
66,gifs,Good Doggo Catches Heckin Fast Ball in SlowMo
67,gifs,Spacial awareness
68,gifs,Suspect wanted for murder needing his inhaler during a police chase
69,gifs,Don't become the fish. Artist Benjy Brooke
70,gifs,Nightmare fuel
71,gifs,Restaurant with projection table
72,gifs,That time Burt Reynolds spoke French on Jeopardy
73,gifs,A mammoth iceberg - the size of Delaware and weighing over a trillion tons - dislodges from the Antarctic ice shelf and begins to drift northwards.
74,gifs,Predicting Machine Gun Kelly's fate
75,gifs,High speed drone race
76,gifs,Why do people do this sort of thing...
77,gifs,ohhh NOOO
78,gifs,Chef makes it rain fire
79,gifs,The kitten slide
80,gifs,Perspective is Everything
81,gifs,Keanu Reeves is awesome
82,gifs,Jennifer Lawrence crashes a Hollywood bus tour
83,gifs,This kitten is a tumbler at heart
84,gifs,"Godspeed, Spider-Man!"
85,gifs,Dance
86,gifs,🦆 Before and After Burning Man 🦆
87,gifs,Poking eyes left &amp; right
88,gifs,"Buddy: Hey pal, can you give me a push? Me:"
89,gifs,How skyscrapers cut through low clouds
90,gifs,Young Jason Statham in a commercial during the 90's
91,gifs,"Last autumn. Suceava, România"
92,gifs,Crosswind landings can be very dangerous
93,gifs,Indoor tropical rain forest display
94,gifs,Cool speedramp effect to make GIF's from drone video
95,gifs,I did my makeup in stop motion today. [OC]
96,gifs,Smooth ride.
97,gifs,Breast cancer cell moving through a blood vessel
98,gifs,"Newly discovered asteroid #2018RC (~50 m in diameter) will have a close encounter with Earth on September 9, 2018 at 12.06 UTC flying at ~0.58 Lunar Distances (or ~222,000 km)"
99,gifs,Deputy Prime Minister of Uganda starts the match with a ceremonial kick
100,gifs,First thing I made on my phone while teaching myself how to animate...issa hot dog
101,gifs,Soldiers on Metro
102,gifs,Idiot LV 1000
103,gifs,Brie Larson as Princess Valhalla Hawkwind before becoming Captain Marvel
104,gifs,New generation vs older generation
105,gifs,Well this was unexpected.
106,gifs,Preperation is the key
107,gifs,Entertaining the kids
108,gifs,Cars in Japan be like
109,gifs,Gaining their trust
110,gifs,What a Cock is that? Never Seen So Big.
111,gifs,Cruising on the flower sea
112,gifs,Iceberg straight ahead!
113,gifs,Which Movie does this Transformer come to play?
114,gifs,Balloon animals reanimated after being frozen in liquid nitrogeon
115,gifs,That time Undertaker almost killed himself
116,gifs,Dog is not impressed by CAT. 5e
117,gifs,She's wrong but determined
118,gifs,A Duck Not Giving A Duck
119,gifs,Mona Lisa by street artist
120,gifs,Seal party
121,gifs,Server put on a X-men style table side show
122,gifs,Fish 10/10 jump right into the tank
123,gifs,"Hey Ladies, Looks Like You Could Use a Man on a Wheel!"
124,gifs,Dog tries to drink a shadow
125,gifs,A pet animal like any other
126,gifs,Moving traffic with lightning.
127,gifs,I just wanted a kiss
128,gifs,Just two pals running
129,gifs,"Heres a thing i made, It is not a cry for help."
130,gifs,He's not going to do that again
131,gifs,Japan to shut power plants in Hokkaido after a M6.7 earthquake hits the island
132,gifs,I raise that train dad joke
133,gifs,What is this??? A fight for ants??
134,gifs,There's no place like Hazzard County!
135,gifs,Smart kitty reading a serious book
136,gifs,Symbiosis at its best. A fire shrimp doing dental work for a moray eel.
137,gifs,Gregg and Angus By LITTLE TITAN
138,gifs,"One, nothing wrong with me, Two, nothing wrong with me, Three, nothing wrong with me, Four, nothing wrong with me - Let the bodies hit the floor!"
139,gifs,Unusual pool dive
140,gifs,Sailboats getting ready for a race. (Hyperlapse)
141,gifs,Japan is always a step ahead
142,gifs,Rare northern hairy-nosed wombat baby playing around
143,gifs,Advanced microscopy reveals how immune cells sample
144,gifs,Fumbling robber drops his gun and his pants
145,gifs,Do you consider this racist?
146,gifs,"I found this. I can relate to this entirely. The poster I found is B45M5N. Please post more like these, thanks."
147,gifs,"One guy, two packs"
148,gifs,A shroomy .gif from Radio Is On días
149,gifs,"Rivers of lava flowing from Kilauea, Hawaii."
150,gifs,The biggest Alaskan Malamute i have ever seen
151,gifs,Whale almost lands on boat full of tourists
152,gifs,Elon Musk: Capital Management 101
153,gifs,Almost nothing but net!
154,gifs,Door knob machining.
155,gifs,This App With Avatars Works On Old iPhones. (iPhone X) vs (iPhone 5S)
156,gifs,Better record this
157,gifs,wink wink
158,gifs,Say hello to the Solar Panda!
159,gifs,"Sweet moves, bruh"
160,gifs,You have betrayed me rubber ducky...
161,gifs,Lobster shedding it's shell.
162,gifs,I'll only give my opinion if we can agree to be adults
163,gifs,gravity for downloading
164,gifs,Super Mario Kart in real life
165,gifs,"When life gives you bananas, become banana man."
166,gifs,Independence Day 3: Labor Day
167,gifs,How to straighten a pigs tail.
168,gifs,Baby waving to everybody in a costco
169,gifs,Our cats are not friends
170,gifs,Startled by bad hooman manners
171,gifs,"Oh, 90's Capcom..."
172,gifs,Meteor leaves a smoke ring
173,gifs,Exploding Rainbow Orb
174,gifs,Transforming Skateboards
175,gifs,Finally somebody who likes cardistry
176,gifs,Streching for dummies.
177,gifs,My Favorite Place in KC!
178,gifs,Pixel art phenakistoscope
179,gifs,Spider-Man PS4
180,gifs,"I was going through my files, and found this cool gif my friend made a while ago"
181,gifs,Library art
182,gifs,A plane drawing a smiley face in the sky
183,gifs,Three days’ ride as the Nazgûl flies
184,gifs,Dingle Cherry
185,gifs,Chad has been yeeted. [part 5]
186,gifs,Some serious bad blood
187,gifs,Red hot snake charmer
188,gifs,Satisfying Pendulum Loop
189,gifs,Also... he doesn't like being recorded!!!
190,gifs,"Look at my balls, look!!!!"
191,gifs,When commenting on a front page post that is two hours old
192,gifs,Did you assemble your pug correctly?
193,gifs,Who needs a Q-tip if you've got a friend?
194,gifs,I'll see your Pirate ship and raise you a Japanese 'Welcome Baby' card!
195,gifs,30 minutes of the Milky Way over Big Bend National Park
196,gifs,Ouch
197,gifs,Want a big saw? Here's a big saw.
198,gifs,I tried
199,gifs,Caught in the Crossfire
200,gifs,Never sleep on a bar stool
201,gifs,Surgical precision...
202,gifs,Eating a salad.
203,gifs,Fail...
204,gifs,"People who say this is photoshopped are a bunch of haters, I tell you hwat"
205,gifs,17 yard line!?!
206,gifs,Kevin Bacon High-Fiving Forever
207,gifs,Vice President Pence secretly and desperately trying to signal the use of the 25th amendment.
208,gifs,Waking up like this.
209,gifs,Driving through New Hampshire
210,gifs,The view from this restaurant
211,gifs,Feeding a Giraffe in reverse
212,gifs,(3) Adrien Brody in The Darjeeling Limited
213,gifs,This Steak Is Aged In A Log Of Butter
214,gifs,Crowd countdown
215,gifs,Annie plays volleyball
216,gifs,Alternative take off
217,gifs,Bearded Dragon is displeased with an offering.
218,gifs,Pittsburgh being illuminated by the sun
219,gifs,Fallout friends
220,gifs,Noodle slinger
221,gifs,"Epic Sunset on the largest canyon in the Solar System, Mars' Valles Marineris!"
222,gifs,Why you shouldn't smoke or drink during pregnancy..
223,gifs,So relaxed
224,gifs,Meals Taste Better Together
225,gifs,Fadt doggo...
226,gifs,Acrobatic bread toaster ejection
227,gifs,Bird takes the tip.
228,gifs,Wire Springer
229,gifs,Look below the surface.
230,gifs,"Best buddies, Seamus and Bubbles"
231,gifs,Train passing through active market
232,gifs,This bee eating this roach
233,gifs,Knife skills
234,gifs,Multitasking
235,gifs,Backdraft Training
236,gifs,Tom Hiddleston pretending to be Loki pretending to be Captain America
237,gifs,I present to you the Pizza Pouch.
238,gifs,About to get wet..
239,gifs,golf ball defies gravity
240,gifs,Rolling over for a better look at the strange looking human
241,gifs,Knotical👌🏽
242,gifs,"Archie the thief, steals stuff to annoy his owner"
243,gifs,Snuggles
244,gifs,want know how long did they practice?
245,gifs,Just do it
246,gifs,Typhoon hits Japan
247,gifs,Coolest minesweeper ever
248,gifs,Happy Neck Scratches
249,gifs,Mesmerizing Waves
250,gifs,mother nature is cruel
251,gifs,I want a horse now
252,gifs,Rollin into work the day after labor day like...
253,gifs,Slate slitter
254,gifs,Blow dry and set please
255,gifs,demonstrations always go wrong
256,gifs,Bye Harvey’s friend. [part 4]
257,gifs,Pup Vs Dust Devil
258,gifs,Dude straight up pulled off a Clark Griswold
259,gifs,Snacking
260,gifs,Funny dance
261,gifs,Meanwhile in highschool...
262,gifs,Wallaby Grooming
263,gifs,This giant baby
264,gifs,The deep sea diver giant marionette
265,gifs,Cardboard car game
266,gifs,Photoshop Noise Reduction [OC]
267,gifs,Obama and McCain were always homies
268,gifs,Parenting fail
269,gifs,Swerving cars - another way to die while being an ass
270,gifs,Cat bath time
271,gifs,A bat flew into my sister's room... again.
272,gifs,Sunrays on escalator
273,gifs,A 9 armed sea star slowly moving towards the sea
274,gifs,Rivals need to be eliminated by any means
275,gifs,Simpson-ception
276,gifs,I present to you: World's smartest Kid
277,gifs,The Wasp cosplay by Chris Lee
278,gifs,"Complex waterwheel system near Zhangjiajie, China"
279,gifs,I can not understand why people would pay to do this.
280,gifs,"Missing the split, but getting a consolation prize."
281,gifs,when it sounds water flow
282,gifs,I am quit thirsty....
283,gifs,My Nek Hurts
284,gifs,Cycling on the beach isn't easy
285,gifs,Labor Day weekend is for heroes like this daredevil
286,gifs,Peek-a-Boo
287,gifs,Time lapse of Hawaii's Pu'u O'o caldera collapse during eruption
288,gifs,Crow plucking fur from a deer's ass
289,gifs,My full intentions for Round 1 of this Fantasy Football season
290,gifs,I've always loved this composite shot from Speed Racer
291,gifs,"Wait, what?"
292,gifs,This girl is buff!
293,gifs,This kid is going places
294,gifs,"Erosion differences between 15,25&amp;50 years"
295,gifs,A Squirm of Worms
296,gifs,Medusa jellyfish spotted by NOAA's Ocean Explorer
297,gifs,(2) Adrien Brody in The Darjeeling Limited
298,gifs,5 person jump rope stunts from the 2018 world jump rope competition
299,gifs,Sunlight in my room at 9 PM
300,gifs,Look what I caught mum!
301,gifs,My wheel!!!
302,gifs,Russians are great.
303,gifs,President Bush slapping President Obama's butt with his binder after his speech at John McCain's funeral
304,gifs,Ball is so much fun!
305,gifs,Pegasuses
306,gifs,And FSU falls 24-3 to VT. This sums up the game.
307,gifs,HE DID IT!
308,gifs,Watermelon doggo
309,gifs,cat：close it！
310,gifs,Drone breaking in mid-air
311,gifs,A frog eating a frog
312,gifs,She could fly!
313,gifs,How square tins are made
314,gifs,He can’t get up!
315,gifs,Gotcha!
316,gifs,Best gatekeeper
317,gifs,Happy 54th Birthday Keanu Reeves! He knows Kung Fu
318,gifs,Time to go!
319,gifs,More Multitasking - Rubiks Cube + Unicycle + 2 Balls
320,gifs,Who's driving
321,gifs,Backflip Golf Trick Shot
322,gifs,2018 World jump rope competition
323,gifs,Eiffel Tower Illuminations Cinemagraph
324,gifs,New type of volcanic debris (tephra) observed - scientists baffled.
325,gifs,Friends Playing Together
326,gifs,An interesting title
327,gifs,Kitten plays fetch with flawless return
328,gifs,Ya'll might be too young to hear legends of 'The Bandit'. Lemme tell you...he could ride.
329,gifs,My favorite line from Sicario 2
330,gifs,Veronica Belmont
331,gifs,Funny DOG dancing
332,gifs,This Doggo got his first wheels. He can finally be a dog again
333,gifs,Flying Hamster.
334,gifs,Welcome to the jungle...
335,gifs,Baseball fan gets a souvenir to take home.
336,gifs,Space Dummy
337,gifs,"Steve Irwin being visited at work, by his daughter dressed in a lion costume"
338,gifs,Hugs
339,gifs,Eye contact is key
340,gifs,How to end a fight
341,gifs,Looking for some critiques of my form
342,gifs,Secret level
343,gifs,Phew!!!! me after leg day.....
344,gifs,"Sulphur-crested cockatoo does a barrel roll at Grant's Picnic Ground, Melbourne, Australia"
345,gifs,This thing is fun
346,gifs,"My son drops shaker egg, I catch it, he doesn't know where it went"
347,gifs,Not CGI
348,gifs,Let me join the party
349,gifs,This reminds us all to have a good time on our day off
350,gifs,Stunt went wrong but his karma game is strong.
351,gifs,Last one there is a stinky cat!
352,gifs,An air tunnel flight instructor acting like Spider-Man.
353,gifs,Super Affectionate Kangaroo
354,gifs,50 cents Please
355,gifs,My cat is a Jack-in-the-Box
356,gifs,Riding through wisteria
357,gifs,Key Unlocking Door
358,gifs,The basic construction of regular geometric shapes with only a compass and ruler
359,gifs,Jump!
360,gifs,This restaurant in China
361,gifs,Who said that I'm too old for this crap?
362,gifs,another US open classic
363,gifs,Steel wool igniting in a near pure oxygen atmosphere
364,gifs,Every time I see this it looks like a game to me
365,gifs,Lets waow the crowd
366,gifs,"""Stop! No, stop! Leave him alone!"""
367,gifs,Cooperation
368,gifs,Kyrgios reaction to Federer's amazing around the post winner.
369,gifs,I'll upvote your mum's Christmas Tree and raise you this Pirate Ship... Didn't know Reddit loved cards so much
370,gifs,Almost stole the punters shoe
371,gifs,"Don't mess with Dad, kid!"
372,gifs,Little guy trying to transfer his drink.
373,gifs,Coffee shop in Vienna
374,gifs,Chad has joined the army. [part 3]
375,gifs,Apple didn't let this AI app that turns people into cartoon characters go live. Guess why?
376,gifs,Columns
377,gifs,Insane Skill and Finger Dexterity
378,gifs,"Sir, you have two options."
379,gifs,Watching an aerobatic jet flyby from on top of the CN tower
380,gifs,"Since reddit is all about pop up cards lately, I thought I’d post this one I came across today."
381,gifs,Kitten comin' at ya!
382,gifs,Becoming a DJ with some streetlight
383,gifs,Nautical bro🤙🏽
384,gifs,George W. Bush sneaking a piece of candy to Michelle Obama is warming my heart.
385,gifs,This avant garde combination at the US Open
386,gifs,My friend has built a very detailed Lego Batcave
387,gifs,Italian official Fight Club (annual match)
388,gifs,Gostra. A Maltese Tradition where locals have to grab a flag at the end of a greasy pole.
389,gifs,I want to get off now...
390,gifs,A new way to chop vegetables
391,gifs,I present you The Common People's Aquaman
392,gifs,Gem
393,gifs,wow taking a bath enjoy life
394,gifs,Overcome Fear
395,gifs,"Damn, that escalated!"
396,gifs,Incredible footage of the collapse of the North Tower
397,gifs,Dogo seem mildly satisfied
398,gifs,Cool hygiene situation.
399,gifs,How to draw a perfect circle freehand
400,gifs,A monkey clinging to a Chihuahua
401,gifs,This gadget for racing games
402,gifs,Train Of War
403,gifs,Pls dont stop
404,gifs,Marvelous Abraham Lincoln Animatronic
405,gifs,"NEVER ""GiveUP"""
406,gifs,A lady of leisure
407,gifs,standing doubble backflip
408,gifs,Straight from a passenger window pov
409,gifs,Touchdown on a bunt return.
410,gifs,Pulling power of a Belgian draft horse against 18 men
411,gifs,Our planets if they were as far away from the Earth as our moon
412,gifs,"me, when everyone else is freaking out at work"
413,gifs,It was only supposed to be a dummy run
414,gifs,Soccer skills
415,gifs,"The wing structure of the hornet, in relation to its weight, is not suitable for flight, but he does not know this and flies anyway"
416,gifs,This may be more fish than a kitten can handle
417,gifs,cute birdie
418,gifs,An artist performed for her backup dancers at their wedding. The dancers instinctively joined in
419,gifs,How to drive a manual transmission car.
420,gifs,My toenail died and new one started growing. Photos from July - November 2017. Old nail is still there
421,gifs,Eiffel Tower Illuminations
422,gifs,You can see my pulse through the blister
423,gifs,A sped-up video of Tokyo's Yurikamome elevated train
424,gifs,Marble City Cinemagraph
425,gifs,Nice shot
426,gifs,Creepy Pastor Digs Fingers Into Ariana Grande's Breast at Aretha Franklin's Funeral
427,gifs,8 year boy request his mother to stop her car... he have seen one old man trying to get stairs up he went there to help him
428,gifs,Poof!
429,gifs,Can't touch this
430,gifs,"My cat once threw a tennis ball by accident, I rewarded him for it, now he can throw tennis balls on command, and soon I'm going to teach him how to aim it"
431,gifs,Iceland Night by @Grafixart_photo
432,gifs,Getting in a quick shave before work
433,gifs,Electricity + pickles
434,gifs,Perfect loop of Starman
435,gifs,"""Who wants some belly rubs? Who wants belly rubs!?"""
436,gifs,Portable mining cave
437,gifs,Thanos Stares into minecraft
438,gifs,Beluga whales blowing bubble rings for fun
439,gifs,Time to move ...
440,gifs,The little tortoise that could
441,gifs,Sometimes we could all use a hug
442,gifs,How to trick your dog into leaving the bedroom...
443,gifs,No more excuses to replace the TP roll.
444,gifs,"11 years since the last time I skated, I still got it. Well, most of it. A little rusty."
445,gifs,Go ahead... do your happy dance
446,gifs,This guy at our python programming classes
447,gifs,My mom started making greeting cards and is nervous about doing her first craft fair tommorow. I thought I'd share her latest creation with you to show her that people like her stuff.
448,gifs,Lets ride this mattress down the stairs
449,gifs,Helping my community clear the flood
450,gifs,My grandma's christmas cards got really Bizarre
451,gifs,Beach safety demo [OC]
452,gifs,Tories can't dance.
453,gifs,YOU LOVE ME HUH?
454,gifs,New gif format?
455,gifs,"Spin, Spin, Spin .."
456,gifs,Lightning Strokes and Sand Pipers Dance
457,gifs,Wanna' play?
458,gifs,When know You have selected for your job.
459,gifs,Shitty 3D-print
460,gifs,Slow motion seagull through rainy window [OC]
461,gifs,It's about commitment
462,gifs,"This fly trap that can catch up to 20,000 flies doing its job well."
463,gifs,Bird using paper as flashy new feathers
464,gifs,Non-stop Ferry Sunset
465,gifs,take me to my home!
466,gifs,Hummingbird slowing to a hover
467,gifs,Pupper steals skateboard
468,gifs,Michael Jackson Spins 6 times
469,gifs,So much chill
470,gifs,September Tire Swing
471,gifs,rad youngin' being a rad youngin'
472,gifs,T.J. Vasher of Texas Tech makes a one-handed catch
473,gifs,Sailor Moon plays the Initial D arcade game
474,gifs,A Snake Wire
475,gifs,This Korean singer don't make mistakes
476,gifs,Autumn joy
477,gifs,When their joke becomes progressively more offensive
478,gifs,You can't see me
479,gifs,"Panda Only Knows how to climb up the trees, but dont know how to get down."
480,gifs,Spectator gets hit with debris from a demolition
481,gifs,Jet Ski explode on child and instructor and throws them into the air!
482,gifs,Playing with the new puppy.
483,gifs,"Sir, please remove all of your cuteness material and put them into the bin"
484,gifs,Sundae Sunday
485,gifs,Calf would like some cuddles too
486,gifs,Passing the ball around
487,gifs,Classic Federer
488,gifs,Chippy will go to any extream to get that peanut.
489,gifs,Sea of Ducks
490,gifs,Creepy. Could you imagine?
491,gifs,Even road workers need a break
492,gifs,Having a little too much fun at DQ...
493,gifs,I think Bowie likes his new dog bed
494,gifs,Kid without hands makes two 3-point shots to end high school basketball game.
495,gifs,Glass frog's heart
496,gifs,"This cat showed up at the Berlin Zoo one day and became best friends with Maeuschen, a 40-year old Asian bear."
497,gifs,Awww Awww Awww...!!!!
498,gifs,Airport employee celebrates cone toss with victory dance.
499,gifs,Both skateboard and spirit were broken this day
500,gifs,I hear you all luke pop up cards now
