,subreddit,title
0,news,Burt Reynolds Dies at 82
1,news,Whole Foods employees said to be trying to unionize under Amazon ownership
2,news,"Twitter Bans Alex Jones, Citing Harassing Messages"
3,news,Police raid New Jersey couple's home after $400G in GoFundMe cash they raised for homeless veteran disappears
4,news,Cranberries singer O'Riordan drowned after drinking
5,news,Jury Fines Man $1 For Punching Charlottesville Rally Organizer
6,news,"Active shooter reported in downtown Cincinnati, OH"
7,news,"Former Arkansas State Senator Sentenced To 220 Months In Federal Prison For Wire Fraud, Mail Fraud And Money Laundering"
8,news,"Gwyneth Paltrow's Goop to pay $145,000 over claims its vaginal eggs have health perks"
9,news,"Atlanta Mayor orders city to end relationship with ICE, remove all detainees from city jail"
10,news,Hospital groups launch own company to make generic drugs
11,news,Chase Bank Employee Sentenced for Stealing $300K from Elder Clients
12,news,"California bans cities from charging residents ""prosecution fees"""
13,news,Source: NY Catholic dioceses subpoenaed in sex abuse probe
14,news,"Candidate tells Chinese supporters she still opposes transgender restroom policy, gives different message in English"
15,news,Mexican prosecutors find 166 skulls in mass graves
16,news,"More Than 1,300 Animals Seized from Alleged Dog, Cockfighting Operation in Wisconsin"
17,news,"Rich DeVos, Amway co-founder and owner of the Orlando Magic, has died at age 92"
18,news,Brazilian Presidential Candidate Jair Bolsonario Stabbed
19,news,"New Orleans jail staffers ignored dying man’s cries for help, lawsuit charges"
20,news,Italy abolishes requirement for parents to prove children have been vaccinated
21,news,US manufacturing at highest level in more than 14 years
22,news,Selfie-taking teen backs up over 850' Nevada Falls in Yosemite falls to death
23,news,'Blu' macaw that inspired movie Rio is one of eight bird species newly listed as extinct
24,news,"8,000 kg of Shark Fins Bound for China Seized from Mumbai, Gujarat - News18"
25,news,Teacher struck and killed by a vehicle after school in front of children.
26,news,"Decade after housing crash, Fannie Mae and Freddie Mac are Uncle Sam's cash cows"
27,news,Roy Moore suing Sacha Baron Cohen for defamation over TV sketch mocking him
28,news,Adam Venit Retiring From WME As Terry Crews Suit Settled
29,news,"DOJ to announce charges against North Koreans for Sony hack, Wannacry attack"
30,news,Texas Fetal Burial Law Struck Down in Another Blow to Abortion Restrictions
31,news,Company that gave rapist keys to dozens of apartments refuses to compensate victim
32,news,A five judge bench has unanimously declared gay Sex legal in India
33,news,"IBM Used NYPD Surveillance to Tag People by Skin Color, Ethnicity"
34,news,"Top plastic polluter Indonesia mobilises 20,000 people to clean up mess"
35,news,Ohio Police: Officer violated policy when he used Taser on 11-year-old shoplifting suspect
36,news,New ‘Popular’ Oscar Scrapped by Film Academy for 2019
37,news,"Laws Punishing Homeless People for Sleeping in Public Are Cruel and Unusual, Court Rules"
38,news,"Family reveals crash video, details: South Bend cop ran red light at 90 mph and had siren off"
39,news,World's largest offshore wind farm opens
40,news,"The Navy’s top lawyer unlawfully scuttled a SEAL’s case, court rules"
41,news,"Johnny Bobbitt will get his full $400,000, GoFundMe says"
42,news,"Delta Fire north of Redding, CA began September 5, 2018 now over 15000 acres burned."
43,news,City sues firefighter with cancer over workers' comp
44,news,"Filing: Mohamed Noor raised red flags among psychiatrists, training officers"
45,news,Gymnastics trainer who worked with Larry Nassar arrested in Texas
46,news,Maryland charges Insys with engaging in deceptive opioid scheme
47,news,Gunmaker American Outdoor Brands jumps more than 20 percent after earnings beat
48,news,Flights from France and Germany land at PHL after passengers exhibit flu-like symptoms
49,news,"Nobody gets sued for illegally downloading movies, right? — Think again, Canada"
50,news,British Airways personal and financial customer data for the past 2 weeks has been leaked
51,news,Emirates superjumbo jet quarantined at JFK after 100 passengers fall ill
52,news,Uber to block low-rating riders in Australia and New Zealand.
53,news,Boston police captain's son faces 20 years for terror plot
54,news,"Boy, 15, beheaded himself with chainsaw after losing computer game"
55,news,Scene Pulled From ‘The Predator’ After Studio Learns Actor Is Sex Offender
56,news,Teen says he was denied service at donut shop because of service dog
57,news,"US Repatriates 2 Antique Statues, Worth $500,000, Stolen From India"
58,news,"Hurricane Florence's Path Shifts Westward, Putting Bermuda On Notice"
59,news,"US, Canada, France and Germany back UK over novichok attack | UK news"
60,news,"Local Banker pays for college tuition for high school graduating class, ""because it's the right thing to do."""
61,news,Myanmar woman escapes six years of captivity in China
62,news,Tour of Britain bike turned into penis
63,news,'Alone and in fear': ordeal of married gay couple forced to flee Russia
64,news,Ford recalls two million trucks to address seat-belt fire concerns
65,news,'Gilligan's Island' star Dawn Wells seeking $180K from fans to help pay debts
66,news,CBS board in negotiations for CEO Moonves exit from the company: sources
67,news,"GoFundMe gives $20K to homeless vet in money dispute, says it is working with authorities"
68,news,School resource officer on unpaid leave after using a taser near a student to wake him up
69,news,"A woman who pranked her husband by claiming she had won £250,000 on the lottery won £1m three weeks later."
70,news,New York scientists use new DNA tools to identify 9/11 victims
71,news,'Predatory Bacteria' Might Be Enlisted In Defense Against Antibiotic Resistance
72,news,Redding CA hit with another fire days after massive Carr fire reached 100% containment
73,news,ICC Pre-Trial Chamber I rules that the Court may exercise jurisdiction over the alleged deportation of the Rohingya people from Myanmar to Bangladesh
74,news,Confederate group loses fight over Ole Miss' Civil War monuments changes
75,news,Affidavit: Rookie Lawrence police officer said she meant to tase man at traffic
76,news,"Aaron Rodgers agrees to 4-year, $134M extension"
77,news,Mobile Baybears to be renamed the Rocket City Trash Pandas after move to Huntsville
78,news,Congressman 'auctions' shouting protester out of hearing
79,news,A man put up an electric fence near a school bus stop to keep kids off his lawn
80,news,"Airport security trays carry more germs than toilets, study reveals"
81,news,The Latest: Immigration enforcement agents visit Iowa farm
82,news,Colleges Misreport Data to Inflate U.S News Rankings and Mislead Students
83,news,US trade deficit jumps by the most in 3 years
84,news,"India stepmother arrested for 'ordering' gang rape of girl, 9"
85,news,Lion jumps into car full of tourists at safari park in Crimea
86,news,No charges against Florida mom seen dunking 3-year-old's head in toilet: report
87,news,Israeli wall rising near border with Lebanon stokes tensions
88,news,Exclusive: U.S. Air Force RQ-4 Global Hawk Drone Crashed Off Spain Last June
89,news,Bail reform that stops requiring cash gets mostly good reviews in Indiana
90,news,"Nearly 6,000 teachers on strike as contract battles continue"
91,news,Royal Navy Aircraft Carrier HMS Queen Elizabeth Arrives at Naval Station Mayport Marking its First Visit to the U.S.
92,news,Boy dies after having medical emergency on Fairfax Co. school bus
93,news,Former Wisconsin pastor guilty of assaulting minors in Arizona
94,news,Man arrested after repeatedly crashing truck into Texas TV station: media
95,news,Justice Dept. announces charges against North Korean for Sony hack
96,news,Former Pearland PD officer arrested on invasive recording charge
97,news,Man testified he chopped up wife's body to keep his children
98,news,California wildfire shuts down major interstate highway
99,news,Salisbury Novichok poisoning: U.K. to brief UN on Russian suspects
100,news,Iraq: Protests continue in Basra in third night of clashes with security forces
101,news,"As Mercedes introduces an electric SUV, Tesla's stock slumps"
102,news,Man finds out coworker is biological father.
103,news,"Portland Burgerville workers serve 'Abolish ICE' message, much to company's discomfort"
104,news,"Florida priests caught having sex in car, arrested - KTVQ.com"
105,news,US called for “sectoral sanctions” to block joint inter-Korean railway inspections
106,news,Hurricane Florence strengthens on possible path to Bermuda
107,news,"Mom lied about son's disappearance to cover up murder, police in Florida say"
108,news,Hurricane Florence taking aim at US East Coast
109,news,"Theranos, Elizabeth Holmes' startup, is shutting down for good"
110,news,'Cosby Show' actor Geoffrey Owens says he quit N.J. Trader Joe's after 'devastating' job-shaming
111,news,Russia weighs possibility of deliberate act in space station damage
112,news,Walmart stores close overnight amid financial fall
113,news,"Boy, 15, dies after being shot outside Providence school"
114,news,Man gets probation in sexual assault of a child
115,news,York County wife accused of poisoning husband shot him with crossbow in 2016
116,news,More than 15 arrested in Myrtle Beach prostitution bust
117,news,"$400,000 raised for homeless man is gone, attorney says"
118,news,Ecological disaster in Crimea’s Armyansk: Kids evacuated
119,news,"Parents of child molested by Marine colonel seek $25 million for pain, suffering"
120,news,Elon Musk renews pedophilia claims against diver in Thai cave rescue
121,news,Utah driver sues Tesla after crashing in Autopilot mode
122,news,Dog bites suspect who tried to kidnap 11-year-old girl in Pasadena
123,news,Los Angeles County prepares for fire season with arrival of Super Scooper planes
124,news,"Strong earthquake strikes northern Japan, causing injuries"
125,news,"Swastika, anti-LGBTQ comments found in dorms at University of Maryland"
126,news,Woman who took photo of 'Cosby' actor working at N.J. Trader Joe's totally regrets it
127,news,"Affidavit: Sedgwick pastor inappropriately touched teen, made her 'very uncomfortable'"
128,news,Dead 1-month-old may have been left in car
129,news,Paramedics grant dying man's sundae wish
130,news,Two Salisbury suspects named by police
131,news,"FTC, states, target bogus veterans' charities in new crackdown: 'It's war profiteering'"
132,news,DNA test proves man who paid $58k in child support isn't the dad
133,news,Veteran TT racer aAan 'Bud' Jackson died after signpost crash
134,news,"No L.A. sex charges for Spacey, Seagal, Anthony Anderson"
135,news,US considers more troops and drills in Greece
136,news,Aretha Franklin’s family found eulogy by Rev. Jasper Williams Jr. ‘distasteful’
137,news,Huge swaths of Philadelphia area schools are issuing multiple early dismissals for the first time ever before winter due to the intense heat wave
138,news,Saudi Arabia declares online satire punishable offence
139,news,ISS records view of Tropical Storm Gordon from space
140,news,Nike shares fall as backlash erupts over new ad campaign featuring Colin Kaepernick
141,news,Charges dropped for man accused of shooting at police officer
142,news,"Woman fakes own kidnapping and robbery to avoid paying employees, police say"
143,news,Four new mountain lion kittens found in Santa Monica Mountains
144,news,"Body of missing 2-year-old boy found in wooded area, mother charged with murder"
145,news,Police arrest man for sexually assaulting beaver in Columbia Park
146,news,Eight bird species are first confirmed avian extinctions this decade
147,news,"Wis. teen dies after extended fast, parents arrested"
148,news,Police clear protesters from Hambach Forest
149,news,"Man admits to printing fake money at library, selling it on Facebook"
150,news,Restaurant Owner Sues NYPD over Wrongful Arrest After Trying to Assist Customer
151,news,Globally endangered shark could be 'wiped out' by commercial fishing: researcher
152,news,UN holds emergency meeting as Asia battles swine fever
153,news,Man 'may have been graffitiing' before being struck and killed by train
154,news,"Mother gives 3-year-old son 'swirly,' video posted to Facebook, death threats follow"
155,news,75 hotel workers arrested at Labor Day protest in California
156,news,Hexagon on Saturn's North Pole May Be 180 Miles Tall... Our understanding of the mechanics behind this phenomena consists of a handful of varied theories.
157,news,Maryland Woman Apparently Mauled to Death by Recently Adopted Pit Bull
158,news,Residents shocked new apartment build will be used for Airbnb instead of long-term rentals
159,news,Tropical Storm Gordon makes landfall in Mississippi; 1 death reported from storm
160,news,"40 years later, she found her son’s baseball mitt 1,000 miles away"
161,news,"Facing excommunication, former LDS bishop says Mormon leaders could learn from Catholic Church"
162,news,"Indiana girl, 2, in critical condition after being shot in head"
163,news,"Japan Hit by Jebi, Strongest Typhoon in 25 Years; 2 Million Urged to Flee"
164,news,Amazon hits $1 trillion market cap
165,news,"Buzz Aldrin slams 'First Man' movie controversy, posts photos of US flag on moon with 'Proud to be American' hashtag"
166,news,2 Women Found Dead in University District Apartment
167,news,Special counsel will accept written answers from Trump about Russia
168,news,Jailed reporters' wives 'devastated' by Aung San Suu Kyi response
169,news,"Charges: Man on LSD choked woman, bit off part of person's finger"
170,news,Devon town has rude awakening after vandals rearrange huge Tour of Britain artwork overnight
171,news,Woman who alleges MTC president raped her is filmed testifying about him in church
172,news,Ronan Farrow breaks silence on NBC-Weinstein controversy
173,news,Dorothy's ruby slippers recovered
174,news,Moose drowns after crowd taking pictures scare it into water
175,news,Colin Kaepernick becomes the face of Nike’s 30th anniversary ‘Just Do It’ campaign
176,news,Michigan Catholic priest to spend on year in jail.
177,news,Chicago on Edge as Officer Who Shot Laquan McDonald 16 Times Faces Trial
178,news,Egypt police arrest man with homemade bomb near US embassy
179,news,"Israeli in custody at Newark airport after he's found with suspicious device, cops say"
180,news,Nearly 500 Tops employees to be laid off by November
181,news,"Retired Cop Beaten To Death In Allhabad, India, Locals Watched"
182,news,Al Qaeda trying to regain primacy as Islamic State loses ground: NATO
183,news,Tropical Storm Gordon Poised to Hit the Gulf Coast as a Hurricane
184,news,California votes to bar schools from starting before 8:30am to help give students more sleep
185,news,Pharmacist denies pregnant woman miscarriage medication over his ethical beliefs
